[
  {
    "ask": 1150275,
    "bid": 1149185,
    "forcedBuyNtl": 0,
    "forcedSellNtl": 0,
    "mark": 1149730,
    "oracle": 1149550,
    "spot": 1149550,
    "t": 1760130180,
    "takerNtl": 1779425
  },
  {
    "ask": 1151930,
    "bid": 1150934,
    "forcedBuyNtl": 0,
    "forcedSellNtl": 0,
    "mark": 1151432,
    "oracle": 1150943,
    "spot": 1150943,
    "t": 1760130240,
    "takerNtl": 3163768
  },
  {
    "ask": 1151423,
    "bid": 1150645,
    "forcedBuyNtl": 0,
    "forcedSellNtl": 0,
    "mark": 1151034,
    "oracle": 1150705,
    "spot": 1150705,
    "t": 1760130300,
    "takerNtl": 1399025
  },
  {
    "ask": 1150218,
    "bid": 1149557,
    "forcedBuyNtl": 0,
    "forcedSellNtl": 0,
    "mark": 1149887,
    "oracle": 1149840,
    "spot": 1149840,
    "t": 1760130360,
    "takerNtl": 2299349
  },
  {
    "ask": 1146629,
    "bid": 1145832,
    "forcedBuyNtl": 0,
    "forcedSellNtl": 0,
    "mark": 1146230,
    "oracle": 1146915,
    "spot": 1146915,
    "t": 1760130420,
    "takerNtl": 3848838
  },
  {
    "ask": 1144099,
    "bid": 1143272,
    "forcedBuyNtl": 0,
    "forcedSellNtl": 0,
    "mark": 1143685,
    "oracle": 1144760,
    "spot": 1144760,
    "t": 1760130480,
    "takerNtl": 3387374
  },
  {
    "ask": 1144327,
    "bid": 1143712,
    "forcedBuyNtl": 0,
    "forcedSellNtl": 0,
    "mark": 1144019,
    "oracle": 1144850,
    "spot": 1144850,
    "t": 1760130540,
    "takerNtl": 2972874
  },
  {
    "ask": 1143033,
    "bid": 1142480,
    "forcedBuyNtl": 0,
    "forcedSellNtl": 0,
    "mark": 1142756,
    "oracle": 1143700,
    "spot": 1143700,
    "t": 1760130600,
    "takerNtl": 2328510
  },
  {
    "ask": 1135168,
    "bid": 1134030,
    "forcedBuyNtl": 0,
    "forcedSellNtl": 0,
    "mark": 1134599,
    "oracle": 1136994,
    "spot": 1136994,
    "t": 1760130660,
    "takerNtl": 3774698
  },
  {
    "ask": 1128180,
    "bid": 1126594,
    "forcedBuyNtl": 0,
    "forcedSellNtl": 0,
    "mark": 1127387,
    "oracle": 1130802,
    "spot": 1130802,
    "t": 1760130720,
    "takerNtl": 6891483
  },
  {
    "ask": 1116165,
    "bid": 1113696,
    "forcedBuyNtl": 0,
    "forcedSellNtl": 9771884,
    "mark": 1114930,
    "oracle": 1120212,
    "spot": 1120212,
    "t": 1760130780,
    "takerNtl": 52172170
  },
  {
    "ask": 1120505,
    "bid": 1118151,
    "forcedBuyNtl": 0,
    "forcedSellNtl": 0,
    "mark": 1119328,
    "oracle": 1122871,
    "spot": 1122871,
    "t": 1760130840,
    "takerNtl": 38769097
  },
  {
    "ask": 1107927,
    "bid": 1104746,
    "forcedBuyNtl": 0,
    "forcedSellNtl": 3791222,
    "mark": 1106336,
    "oracle": 1111827,
    "spot": 1111827,
    "t": 1760130900,
    "takerNtl": 19273149
  },
  {
    "ask": 1087164,
    "bid": 1082482,
    "forcedBuyNtl": 0,
    "forcedSellNtl": 12797933,
    "mark": 1084823,
    "oracle": 1093558,
    "spot": 1093558,
    "t": 1760130960,
    "takerNtl": 38943259
  },
  {
    "ask": 1080219,
    "bid": 1075464,
    "forcedBuyNtl": 0,
    "forcedSellNtl": 0,
    "mark": 1077841,
    "oracle": 1086472,
    "spot": 1086472,
    "t": 1760131020,
    "takerNtl": 52961971
  },
  {
    "ask": 1093515,
    "bid": 1088371,
    "forcedBuyNtl": 5174356,
    "forcedSellNtl": 0,
    "mark": 1090943,
    "oracle": 1095578,
    "spot": 1095578,
    "t": 1760131080,
    "takerNtl": 30868618
  },
  {
    "ask": 1086539,
    "bid": 1081466,
    "forcedBuyNtl": 0,
    "forcedSellNtl": 0,
    "mark": 1084002,
    "oracle": 1089223,
    "spot": 1089223,
    "t": 1760131140,
    "takerNtl": 30187949
  },
  {
    "ask": 1075553,
    "bid": 1070161,
    "forcedBuyNtl": 0,
    "forcedSellNtl": 4368109,
    "mark": 1072857,
    "oracle": 1079379,
    "spot": 1079379,
    "t": 1760131200,
    "takerNtl": 24166218
  },
  {
    "ask": 1072488,
    "bid": 1067525,
    "forcedBuyNtl": 0,
    "forcedSellNtl": 0,
    "mark": 1070006,
    "oracle": 1076000,
    "spot": 1076000,
    "t": 1760131260,
    "takerNtl": 14163134
  },
  {
    "ask": 1073574,
    "bid": 1069336,
    "forcedBuyNtl": 0,
    "forcedSellNtl": 0,
    "mark": 1071455,
    "oracle": 1076171,
    "spot": 1076171,
    "t": 1760131320,
    "takerNtl": 9770838
  },
  {
    "ask": 1085680,
    "bid": 1081031,
    "forcedBuyNtl": 2650648,
    "forcedSellNtl": 0,
    "mark": 1083355,
    "oracle": 1084940,
    "spot": 1084940,
    "t": 1760131380,
    "takerNtl": 16264973
  },
  {
    "ask": 1093478,
    "bid": 1088811,
    "forcedBuyNtl": 0,
    "forcedSellNtl": 0,
    "mark": 1091144,
    "oracle": 1090920,
    "spot": 1090920,
    "t": 1760131440,
    "takerNtl": 7574203
  },
  {
    "ask": 1077989,
    "bid": 1072638,
    "forcedBuyNtl": 0,
    "forcedSellNtl": 3095450,
    "mark": 1075313,
    "oracle": 1078240,
    "spot": 1078240,
    "t": 1760131500,
    "takerNtl": 13315805
  },
  {
    "ask": 1081508,
    "bid": 1076647,
    "forcedBuyNtl": 0,
    "forcedSellNtl": 0,
    "mark": 1079077,
    "oracle": 1080776,
    "spot": 1080776,
    "t": 1760131560,
    "takerNtl": 15743566
  },
  {
    "ask": 1092165,
    "bid": 1087045,
    "forcedBuyNtl": 1446938,
    "forcedSellNtl": 0,
    "mark": 1089605,
    "oracle": 1088930,
    "spot": 1088930,
    "t": 1760131620,
    "takerNtl": 9589259
  },
  {
    "ask": 1100705,
    "bid": 1095511,
    "forcedBuyNtl": 0,
    "forcedSellNtl": 0,
    "mark": 1098108,
    "oracle": 1095846,
    "spot": 1095846,
    "t": 1760131680,
    "takerNtl": 10139775
  },
  {
    "ask": 1106301,
    "bid": 1101290,
    "forcedBuyNtl": 0,
    "forcedSellNtl": 0,
    "mark": 1103795,
    "oracle": 1100768,
    "spot": 1100768,
    "t": 1760131740,
    "takerNtl": 7324103
  },
  {
    "ask": 1128377,
    "bid": 1121955,
    "forcedBuyNtl": 2845476,
    "forcedSellNtl": 0,
    "mark": 1125166,
    "oracle": 1118312,
    "spot": 1118312,
    "t": 1760131800,
    "takerNtl": 8926724
  },
  {
    "ask": 1119338,
    "bid": 1113209,
    "forcedBuyNtl": 0,
    "forcedSellNtl": 0,
    "mark": 1116273,
    "oracle": 1112334,
    "spot": 1112334,
    "t": 1760131860,
    "takerNtl": 14730974
  },
  {
    "ask": 1139224,
    "bid": 1132000,
    "forcedBuyNtl": 1185835,
    "forcedSellNtl": 0,
    "mark": 1135612,
    "oracle": 1128405,
    "spot": 1128405,
    "t": 1760131920,
    "takerNtl": 4103802
  },
  {
    "ask": 1145223,
    "bid": 1138298,
    "forcedBuyNtl": 0,
    "forcedSellNtl": 0,
    "mark": 1141760,
    "oracle": 1134493,
    "spot": 1134493,
    "t": 1760131980,
    "takerNtl": 7776858
  },
  {
    "ask": 1156792,
    "bid": 1149599,
    "forcedBuyNtl": 575821,
    "forcedSellNtl": 0,
    "mark": 1153195,
    "oracle": 1144800,
    "spot": 1144800,
    "t": 1760132040,
    "takerNtl": 3169035
  },
  {
    "ask": 1158786,
    "bid": 1152248,
    "forcedBuyNtl": 0,
    "forcedSellNtl": 0,
    "mark": 1155517,
    "oracle": 1148033,
    "spot": 1148033,
    "t": 1760132100,
    "takerNtl": 4650689
  },
  {
    "ask": 1148858,
    "bid": 1142563,
    "forcedBuyNtl": 0,
    "forcedSellNtl": 0,
    "mark": 1145710,
    "oracle": 1141429,
    "spot": 1141429,
    "t": 1760132160,
    "takerNtl": 4320586
  },
  {
    "ask": 1145087,
    "bid": 1139503,
    "forcedBuyNtl": 0,
    "forcedSellNtl": 0,
    "mark": 1142295,
    "oracle": 1139404,
    "spot": 1139404,
    "t": 1760132220,
    "takerNtl": 6730076
  },
  {
    "ask": 1119762,
    "bid": 1112794,
    "forcedBuyNtl": 0,
    "forcedSellNtl": 4075498,
    "mark": 1116278,
    "oracle": 1118988,
    "spot": 1118988,
    "t": 1760132280,
    "takerNtl": 11372547
  },
  {
    "ask": 1118541,
    "bid": 1112468,
    "forcedBuyNtl": 0,
    "forcedSellNtl": 0,
    "mark": 1115504,
    "oracle": 1117918,
    "spot": 1117918,
    "t": 1760132340,
    "takerNtl": 13667327
  },
  {
    "ask": 1115927,
    "bid": 1110504,
    "forcedBuyNtl": 0,
    "forcedSellNtl": 0,
    "mark": 1113215,
    "oracle": 1115680,
    "spot": 1115680,
    "t": 1760132400,
    "takerNtl": 5904555
  },
  {
    "ask": 1117583,
    "bid": 1112828,
    "forcedBuyNtl": 0,
    "forcedSellNtl": 0,
    "mark": 1115205,
    "oracle": 1116869,
    "spot": 1116869,
    "t": 1760132460,
    "takerNtl": 5760859
  },
  {
    "ask": 1118568,
    "bid": 1114447,
    "forcedBuyNtl": 0,
    "forcedSellNtl": 0,
    "mark": 1116507,
    "oracle": 1117638,
    "spot": 1117638,
    "t": 1760132520,
    "takerNtl": 10842224
  },
  {
    "ask": 1124948,
    "bid": 1120875,
    "forcedBuyNtl": 0,
    "forcedSellNtl": 0,
    "mark": 1122911,
    "oracle": 1122583,
    "spot": 1122583,
    "t": 1760132580,
    "takerNtl": 9449060
  },
  {
    "ask": 1123065,
    "bid": 1119492,
    "forcedBuyNtl": 0,
    "forcedSellNtl": 0,
    "mark": 1121278,
    "oracle": 1121328,
    "spot": 1121328,
    "t": 1760132640,
    "takerNtl": 9437864
  },
  {
    "ask": 1137040,
    "bid": 1132724,
    "forcedBuyNtl": 1804692,
    "forcedSellNtl": 0,
    "mark": 1134882,
    "oracle": 1132204,
    "spot": 1132204,
    "t": 1760132700,
    "takerNtl": 9303292
  },
  {
    "ask": 1145091,
    "bid": 1140621,
    "forcedBuyNtl": 0,
    "forcedSellNtl": 0,
    "mark": 1142856,
    "oracle": 1139020,
    "spot": 1139020,
    "t": 1760132760,
    "takerNtl": 10305224
  },
  {
    "ask": 1141701,
    "bid": 1137716,
    "forcedBuyNtl": 0,
    "forcedSellNtl": 0,
    "mark": 1139708,
    "oracle": 1137134,
    "spot": 1137134,
    "t": 1760132820,
    "takerNtl": 6877876
  },
  {
    "ask": 1145713,
    "bid": 1141913,
    "forcedBuyNtl": 0,
    "forcedSellNtl": 0,
    "mark": 1143813,
    "oracle": 1140843,
    "spot": 1140843,
    "t": 1760132880,
    "takerNtl": 6120989
  },
  {
    "ask": 1137629,
    "bid": 1133762,
    "forcedBuyNtl": 0,
    "forcedSellNtl": 0,
    "mark": 1135695,
    "oracle": 1134830,
    "spot": 1134830,
    "t": 1760132940,
    "takerNtl": 11447209
  },
  {
    "ask": 1132869,
    "bid": 1129214,
    "forcedBuyNtl": 0,
    "forcedSellNtl": 0,
    "mark": 1131041,
    "oracle": 1131242,
    "spot": 1131242,
    "t": 1760133000,
    "takerNtl": 9541706
  },
  {